{
  "body_id": "uk-state-body-department-for-education",
  "last_reviewed": null,
  "notes": "office_type heuristic = other; review.",
  "office_id": "office-minister-for-women-and-equalities-3",
  "office_type": "other",
  "record_status": "extracted",
  "source_ids": [
    "source-official-dataset-govuk-content-api"
  ],
  "title": "Minister for Women and Equalities"
}
